Hanzi,Traditional,Pinyin,Pinyin 2,Meaning,Audio
的,,de,"dí, dì","possessive, adjectival suffix", [sound:sapi5-4915d8a1-ad50f0a2-84a98fb0-543faf2c-f3156edb.mp3]
一,,yī,,"one; a, an; alone", [sound:sapi5-4d0c1a44-52e338bb-8ccae66c-e836cd33-1ce19e1f.mp3]
是,,shì,,"indeed, yes, right; to be; demonstrative pronoun, this, that", [sound:sapi5-08d06ffb-5adeb3e1-697ec518-35ed098c-7e9798e4.mp3]
不,,bù,"fǒu, fōu","no, not; un-; negative prefix", [sound:sapi5-98784768-59838fac-09875739-dbc662f4-34d29235.mp3]
了,瞭,le,liǎo,to finish; particle of completed action, [sound:sapi5-15f10852-64cc9ca3-8036d7c3-43ab2889-c4472559.mp3]
在,,zài,,"be at, in, on; consist in, rest", [sound:sapi5-1498d61f-b2ff93a1-957cf6c9-7c79abac-a22831c8.mp3]
人,,rén,,man; people; mankind; someone else, [sound:sapi5-b65bab7f-639081be-a6498194-384b9ecf-99def084.mp3]
有,,yǒu,yòu,"have, own, possess; exist", [sound:sapi5-8c54253c-722de49c-1d6ecea2-afc891c8-4c346370.mp3]
我,,wǒ,,"our, us, i, me, my, we", [sound:sapi5-ab0ba57a-5d64756d-2480f60a-8223b2cf-3c3ffc50.mp3]
他,,tā,,"other, another; he, she, it", [sound:sapi5-2830cea5-af73f8fc-5151ff98-281f690f-9c9177a8.mp3]
这,這,zhè,zhèi,"this, the, here", [sound:sapi5-4ee53375-3e28dcbc-49b922e3-32e5ddc6-495401c6.mp3]
个,個 箇,gè,gě,"numerary adjunct, piece; single", [sound:sapi5-dce4c56b-79451b72-33c5dc4b-93765670-c1e6537a.mp3]
们,們,men,,adjunct pronoun indicate plural, [sound:sapi5-b108b569-c8e26a8e-0b4108d9-9a2af907-0bdb383d.mp3]
中,,zhōng,zhòng,"central; center, middle; in the midst of; hit (target); attain", [sound:sapi5-93780bca-009c5d75-476f9b04-2763cbe6-38c3105a.mp3]
来,來,lái,lài,"come, coming; return, returning", [sound:sapi5-f77741c5-105c3222-84b86927-5427b86b-7b7ba383.mp3]
上,,shàng,,"top; superior, highest; go up, send up", [sound:sapi5-c8db1ecc-c48dd04e-69aab823-8177e37f-4af31ffc.mp3]
大,,dà,"dài, tài","big, great, vast, large, high", [sound:sapi5-6e62b32d-db4ff93a-136e6f18-dd8b0583-c03e659c.mp3]
为,為,wèi,wéi,"do, handle, govern, act; be", [sound:sapi5-570cf6ac-36aec85a-2c507336-2afa4751-8fbc0ad9.mp3]
和,龢 和,hé,"huò, huó, hè","harmony, peace; peaceful, calm", [sound:sapi5-3cbca5d7-abb90014-329ea66d-0e288ab0-6f4b4c70.mp3]
国,國,guó,,"nation, country, nation-state", [sound:sapi5-a8816632-58992431-165e61aa-addc77fc-ace138e2.mp3]
地,,dì,de,"earth; soil, ground; region", [sound:sapi5-4ed21973-c2859393-631a8f63-b096b8c1-7889b8d9.mp3]
到,,dào,,"go to, arrive, been to", [sound:sapi5-0b9c08c1-0129a0d4-02f52071-7e523b75-f1b4d84b.mp3]
以,,yǐ,,"by means of; thereby, therefore; consider as; in order to", [sound:sapi5-eb1db397-e9b83f13-991998f4-d3fa1940-76987c2d.mp3]
说,説 說,shuō,"shuì, tuō, yuè","speak, say, talk; scold, upbraid", [sound:sapi5-1a7f402d-cbd3e46a-7cdfe7ab-4e83928d-60fbd216.mp3]
时,時,shí,,"time, season; era, age, period", [sound:sapi5-1f2dff9e-dda1435c-6a6b3db5-3d699b05-ba26a999.mp3]
要,,yào,"yāo, yǎo","necessary, essential; necessity", [sound:sapi5-7d33685e-301e0b6d-a57e3160-768c0f11-95620b9a.mp3]
就,,jiù,,"just, simply; to come, go to; to approach, near", [sound:sapi5-32226fb7-c2f456ad-058859bc-6a3b22a2-a48f5d7f.mp3]
出,出 齣,chū,,"go out, send out; stand; produce", [sound:sapi5-f69bdf32-47b4a7ac-33513288-a4da57ae-bf7a16e6.mp3]
会,會,huì,"kuài, guì","assemble, meet together; meeting", [sound:sapi5-f92cf2fd-737c3653-e3dce745-bdf59696-14778f66.mp3]
可,,kě,kè,"may, can, -able; possibly", [sound:sapi5-01684303-5837153d-5ce82d3b-9931f14b-65fa5cc4.mp3]
也,,yě,,also; classical final particle of strong affirmation or identity, [sound:sapi5-50a4a01e-2cea93af-d0213710-9df8bdc5-b39b3c27.mp3]
你,妳,nǐ,,"you, second person pronoun", [sound:sapi5-8c1c058c-31601668-6af35765-f3d93b53-b4465d92.mp3]
对,對,duì,,"correct, right; facing, opposed", [sound:sapi5-d512a647-1242531a-b70e2c5c-119e06df-3c5c5948.mp3]
生,,shēng,,"life, living, lifetime; birth", [sound:sapi5-16b1e17d-60715041-b5b5d4e4-4438ff07-0f9ca267.mp3]
能,,néng,"nài, tái, tài, nái,xióng","to be able; can, permitted to; ability", [sound:sapi5-81373393-8160dd9e-334dc441-5e731dba-94714f74.mp3]
而,,ér,néng,and; and then; and yet; but, [sound:sapi5-f9907999-d8f5ed15-d0658dff-34ae23dc-e3bcad8b.mp3]
子,,zǐ,zi,"offspring, child; fruit, seed of; 1st terrestrial branch", [sound:sapi5-3c046b5e-f465a602-c9ad8139-3d8f6832-5d89a66e.mp3]
那,,nà,"nèi, nā, nǎ, né,něi, nuó, nuò","that, that one, those", [sound:sapi5-fd62b230-798f04a5-2be28e13-728ab5a8-65207478.mp3]
得,,dé,"de, děi","obtain, get, gain, acquire", [sound:sapi5-27ab8641-ad6a096a-01f947ec-2f7d0081-a674cd35.mp3]
于,於 于,yú,xū,"in, on, at; go to; surname", [sound:sapi5-887ef6e2-099e5993-dc192782-e46e630e-0e353f2e.mp3]
着,著,zháo,"zhe, zhāo,zhuó","make move, take action", [sound:sapi5-d69b318a-b632eda0-5fccc8d5-be8408dc-362d607c.mp3]
下,,xià,,"under, underneath, below; down; inferior; bring down", [sound:sapi5-47a9c2c1-6edc0d8a-42c9e7ad-1d63d706-924b9ec7.mp3]
自,,zì,,"self, private, personal; from", [sound:sapi5-36a05e12-90796338-751ea383-948874e5-4e2acb8c.mp3]
之,,zhī,,"marks preceding phrase as modifier of following phrase; it, him her, them; go to", [sound:sapi5-faca15a1-7ed6e2cb-157ea59d-8abc5a52-e4843221.mp3]
年,,nián,,year; new-years; person's age, [sound:sapi5-573788ee-8f78d6e0-41b6fd83-0b9d2305-0508932c.mp3]
过,過,guò,guō,"pass, pass through, go across", [sound:sapi5-fbdc664b-7de60d63-daec8a4e-75af5a30-e77d984d.mp3]
发,髮 發,fā,"fà, fǎ, bō","issue, dispatch, send out; hair", [sound:sapi5-c39a4a1d-a4def461-7b451bed-2feadcda-e705aceb.mp3]
后,後 后,hòu,,"queen, empress, sovereign; (simp. for 後) behind, rear, after", [sound:sapi5-e3cbb831-4b89f095-6a12d550-60639a9c-306040b5.mp3]
作,,zuò,"zuō, zuó","make; work; compose, write; act, perform", [sound:sapi5-c7ccf2d9-efc190b1-0b144cb4-58106906-bd1391eb.mp3]
里,裡 浬 裏 里,lǐ,,unit of distance; village; lane, [sound:sapi5-e57c5b0a-bf55259c-12c7f16e-8d2e5a18-8c2a4acc.mp3]
用,,yòng,,"use, employ, apply, operate; use", [sound:sapi5-e858c91e-8d01cb54-766826ae-f82e32d1-0706318a.mp3]
道,,dào,dǎo,"path, road, street; method, way", [sound:sapi5-ee9e4172-03948167-85ca7e68-4c86d44b-c41d64fa.mp3]
行,,xíng,"háng, xìng,hàng, héng","go; walk; move, travel; circulate", [sound:sapi5-fbc30cd1-892979ff-9da29f92-5bf59ba8-bf1e5576.mp3]
所,,suǒ,,"place, location; numerary adjunct", [sound:sapi5-95a10907-b8c9d2cc-a9836c9a-fd111325-fe762268.mp3]
然,,rán,,"yes, certainly; pledge, promise", [sound:sapi5-b88d337e-1068b5ea-15dac477-34a83c07-070b33c3.mp3]
家,家 傢,jiā,"jie, gū","house, home, residence; family", [sound:sapi5-169a1ab3-6f03fe72-fa1e98d0-59d59599-54f0b67b.mp3]
种,種,zhǒng,"chóng, zhòng","seed; race, breed; to plant", [sound:sapi5-a894d8ee-675c4d3a-7f9ff438-cfd70699-bf57b261.mp3]
事,,shì,,"affair, matter, business; to serve; accident, incident", [sound:sapi5-a5e9bc4a-a267f274-388b8223-3195c4b0-156735e5.mp3]
成,,chéng,,"completed, finished, fixed", [sound:sapi5-a4f86a13-4dadbd04-96cc27ba-03cf0eea-088842b6.mp3]
方,,fāng,"fēng, páng,wǎng","a square, rectangle; a region; local", [sound:sapi5-c3306524-150e2c2f-187c4e93-53653270-09740461.mp3]
多,,duō,,"much, many; more than, over", [sound:sapi5-004c0f52-8081c3a4-fc30fc42-314d1d95-f3b99fda.mp3]
经,經,jīng,jìng,classic works; pass through, [sound:sapi5-bde7cf58-bafb0750-37e0fcdf-2d6bb151-4fe194bd.mp3]
么,麼,yāo,"mo, me, ma,mǒ",interrogative particle; repetition of a tune small; tender, [sound:sapi5-9b7d5fda-81198669-90b71451-dacc14d8-2511cf6f.mp3]
去,,qù,,"go away, leave, depart", [sound:sapi5-4aa5f9f6-2e638958-b21bd665-8a1883c0-67f58faa.mp3]
法,,fǎ,,"law, rule, regulation, statute; France, French", [sound:sapi5-f53079fc-8c86f620-1a5c7e09-2508e9bc-7e159439.mp3]
学,學,xué,,"learning, knowledge; school", [sound:sapi5-8c71d9c3-71278f7f-bf3e700a-b1f71c0f-5b06cd74.mp3]
如,,rú,,"if, supposing; as if; like, as", [sound:sapi5-d58fea8e-09493722-24fbd1ce-d2030a99-625ac608.mp3]
都,,dū,dōu,"metropolis, capital; all, the whole; elegant, refined", [sound:sapi5-4967b39c-682b24ee-3de06e89-55e47b02-3c489ba9.mp3]
同,同 仝,tóng,tòng,"same, similar; together with", [sound:sapi5-50a6d917-0cc1fef7-14b17f57-9595eee3-a5e35d58.mp3]
现,現,xiàn,,"appear, manifest, become visible", [sound:sapi5-d205dae4-6ce3e978-12329759-86c2d731-697cd99b.mp3]
当,當 噹,dāng,dàng,"bear, accept, undertake; just", [sound:sapi5-c9d613f2-b40acacc-9200db59-5cfeb3d0-68d3c8cd.mp3]
没,沒,méi,"mò, me","not, have not, none; drown, sink", [sound:sapi5-257e6830-f976e88d-55a599e0-2f0462b9-80efe092.mp3]
动,動,dòng,,"move, happen; movement, action", [sound:sapi5-eca2395c-0aef191a-34beb80f-691b3628-af049733.mp3]
面,麵 麪 面,miàn,,"face; surface; plane; side, dimension", [sound:sapi5-f45232dc-fa90cfd4-317b14b5-50d1167c-770bb53d.mp3]
起,,qǐ,,"rise, stand up; go up; begin", [sound:sapi5-85fb05e5-cb5f333f-c1f5af92-5689d4d6-0222b33f.mp3]
看,,kàn,kān,"look, see; examine, scrutinize", [sound:sapi5-900b40bf-d2995c58-924055a4-87969057-3f81b766.mp3]
定,,dìng,,"decide, settle, fix", [sound:sapi5-2be7681b-4d984c23-3e36559c-4d07e266-bdef13cc.mp3]
天,,tiān,,"sky, heaven; god, celestial", [sound:sapi5-cd54902b-d672f268-59fdc481-94b8ad6f-bd8654a8.mp3]
分,分 份,fēn,fèn,divide; small unit of time etc., [sound:sapi5-93e76463-f985120e-8b79bfdc-01a451fc-71b8f88d.mp3]
还,還,huán,"hái, xuán","still, yet, also, besides", [sound:sapi5-3677d9dc-d189eae6-af98a9db-7ead44af-90e7e9e4.mp3]
进,進,jìn,,"advance, make progress, enter", [sound:sapi5-042a17bc-53e95c59-80c8244f-b7960da5-6026409e.mp3]
好,,hǎo,hào,"good, excellent, fine; well", [sound:sapi5-3951137f-0c59a567-f0daf6a6-84ca4249-7eaaf4b1.mp3]
小,,xiǎo,,"small, tiny, insignificant", [sound:sapi5-b98146c5-155d3902-8c400bce-c2932b34-6c87b0d6.mp3]
部,,bù,pǒu,"part, division, section", [sound:sapi5-e676241a-ad95b675-4089f235-a2168674-c0398821.mp3]
其,,qí,jī,"his, her, its, their; that", [sound:sapi5-be199b62-aded7acf-3e663345-82047bf3-4e70fe4b.mp3]
些,,xiē,"suò, sā","little, few; rather, somewhat", [sound:sapi5-dcab8c5e-2a41547b-ada9c4e1-080d8a7c-64ab2d03.mp3]
主,,zhǔ,,"master, chief owner; host; lord", [sound:sapi5-3037afda-a773bde5-3304f44f-9528ee35-d3ac2b0b.mp3]
样,樣,yáng,"yàng, xiàng","shape, form, pattern, style", [sound:sapi5-617bdb70-6bdb2c5e-2a8c65e7-292c6205-97e47602.mp3]
理,,lǐ,,"reason, logic; manage", [sound:sapi5-1079d4b8-ba7c5267-1aebf2eb-5d11b017-913208d7.mp3]
心,,xīn,,"heart; mind, intelligence; soul", [sound:sapi5-0deac8d9-2c4d67b5-93cb923e-5abb79be-e53a7963.mp3]
她,,tā,,"she, her", [sound:sapi5-aea4fea2-18bde0ed-aa465319-61a16674-bd37f361.mp3]
本,,běn,,"root, origin, source; basis", [sound:sapi5-7c95895d-ba56363e-fe6922ae-5ef63913-a634ae89.mp3]
前,,qián,,"in front, forward; preceding", [sound:sapi5-60bb07e0-53394b2e-42b6c5f7-5d0ab7ed-4e0e7dc8.mp3]
开,開,kāi,,"open; initiate, begin, start", [sound:sapi5-93df75c6-876f1766-b2b8664d-e7e8e005-6b15b422.mp3]
但,,dàn,,"only; but, however, yet, still", [sound:sapi5-19cf988a-d834b242-69382343-073c0983-230c47ac.mp3]
因,,yīn,,"cause, reason; by; because (of)", [sound:sapi5-6864e114-ac0d2000-d5254b92-5a27149e-ea22a5fa.mp3]
只,只 隻,zhǐ,zhī,"only, just, simply", [sound:sapi5-ce0b9d7c-30eee033-7decdc0c-bba11bea-481c5043.mp3]
从,從,cóng,"zòng, zōng,cōng","from, by, since, whence, through", [sound:sapi5-fc61a1a3-df89f004-8c811243-35b71c05-2f7e7821.mp3]
想,,xiǎng,,"think, speculate, plan, consider", [sound:sapi5-679ec002-bc87441f-b52ad6ef-fef7704c-72244a8e.mp3]
实,實,shí,,"real, true; honest, sincere", [sound:sapi5-da31dc7c-f2706a73-8652cb40-d46d9157-b962e53a.mp3]
日,,rì,mì,sun; day; daytime, [sound:sapi5-3ba905cc-986939ea-1b89c027-1e68914c-599a2f41.mp3]
军,軍,jūn,,"army, military; soldiers, troops", [sound:sapi5-0cdf495e-a86c77d6-85404c88-96fe0e50-559f1efd.mp3]
者,,zhě,zhū,that which; he who; those who, [sound:sapi5-3404d2a7-afb3dab0-16bfc52b-b88bd209-bee30f40.mp3]
意,,yì,,"thought, idea, opinion; think", [sound:sapi5-719dd88c-aed33e2c-392233e1-c2c83cc0-40c4649c.mp3]
无,無,wú,mó,"negative, no, not; KangXi radical 71", [sound:sapi5-6e3265f3-c77cfa16-1ada1ab1-a9ca99dd-614301c3.mp3]
力,,lì,,"power, capability, influence", [sound:sapi5-dd194af0-0b8c82c3-29ea91e6-be725670-f23590ce.mp3]
它,牠,tā,tuō,it; other, [sound:sapi5-a6ddd3e7-dabdbc76-bf1b2dbf-50784827-bf2a22eb.mp3]
与,與,yǔ,"yù, yú","and; with; to; for; give, grant", [sound:sapi5-2687f36b-cb62c944-a867f376-afc42e85-41c65e5e.mp3]
长,長,cháng,"zhǎng, zhàng",long; length; excel in; leader, [sound:sapi5-1df349a0-b7e89a6c-ececd6e7-8a03f30e-0a724268.mp3]
把,,bǎ,bà,"hold, take; guard; regard as", [sound:sapi5-7f31e7be-7ca6b181-f791d9a3-5083d1ec-c27439fe.mp3]
机,機,jī,,desk; machine; moment, [sound:sapi5-7923da40-6b9e2ba2-b6aadb96-50833cd3-14897b11.mp3]
十,,shí,,"ten, tenth; complete; perfect", [sound:sapi5-dad047a5-b36f181b-a790353c-f8f03a36-da871c6a.mp3]
民,,mín,,"people, subjects, citizens", [sound:sapi5-6d260282-3b855b0f-bd6ffb7f-5c9962a3-bdfe5575.mp3]
第,,dì,,"sequence, number; grade, degree", [sound:sapi5-8476ae66-88a7f66b-59899f76-7ae70845-790cfe23.mp3]
公,,gōng,,"fair, equitable; public; duke", [sound:sapi5-de8f47a4-6724094c-a6530686-b8fd83de-d6e9a0fa.mp3]
此,,cǐ,,"this, these; in this case, then", [sound:sapi5-1080490e-a6a343fd-d701c928-4ee2dfa1-c232d788.mp3]
已,,yǐ,,already; finished; stop, [sound:sapi5-0e0cdd26-4edc1853-e334a97f-76d51d43-ac5e3573.mp3]
工,,gōng,,"labor, work; worker, laborer", [sound:sapi5-592a52cb-32723a56-9a94ab18-9687a308-06d108b4.mp3]
使,,shǐ,shì,"cause, send on a mission, order; envoy, messenger, ambassador", [sound:sapi5-7edec8f9-e734ad02-6fbb7dbf-7d3dcd6e-f18d4131.mp3]
情,,qíng,,"feeling, sentiment, emotion", [sound:sapi5-e1954be0-483b7718-1f69c544-aabd7ad4-fe8f5a9d.mp3]
明,,míng,,"bright, light, brilliant; clear", [sound:sapi5-471cd2ed-eea8b869-c826a656-ed7e1584-fe9dc780.mp3]
性,,xìng,,"nature, character, sex", [sound:sapi5-bb022e51-74fc63bf-74b6fb6b-9f7432c7-f9e8fd73.mp3]
知,,zhī,zhì,"know, perceive, comprehend", [sound:sapi5-ca8e9786-98e73e83-ab9fc187-726ab836-172bc363.mp3]
全,,quán,,"maintain, keep whole or intact", [sound:sapi5-cf1644d5-61be0b0f-b762d8e6-f6f1f821-e6fd632c.mp3]
三,,sān,sàn,three, [sound:sapi5-8eb8fc57-0c004f58-fd9851f1-8b832e13-06420c50.mp3]
又,,yòu,,"and, also, again, in addition", [sound:sapi5-fe343470-134c7dc7-fd180eaa-bcbfb50d-7b32e867.mp3]
关,關,guān,wān,frontier pass; close; relation, [sound:sapi5-a598628b-fa980ebb-636ee984-ac3cc5c1-f0917183.mp3]
点,點,diǎn,,"dot, speck, spot; point, degree", [sound:sapi5-0da65523-2bdc98c9-30b01973-3f53ba49-b1f92a46.mp3]
正,,zhèng,zhēng,"right, proper, correct", [sound:sapi5-a413128b-659ab72c-30d9405f-3847aac2-696b9a98.mp3]
业,業,yè,,"profession, business; GB radical 111", [sound:sapi5-c5235829-d5e9b238-1268c0a8-9e122be6-1feb7869.mp3]
外,,wài,,"out, outside, external; foreign", [sound:sapi5-196a09bf-324bc2b2-b3f02007-d0fcd25e-a1adcbef.mp3]
将,將,jiāng,"jiàng, qiāng","will, going to, future; general", [sound:sapi5-44b5c019-552dc30e-172abe8d-3188582d-1ef28b8d.mp3]
两,両 兩,liǎng,liàng,"two, both, pair, couple; ounce", [sound:sapi5-c1f8adac-dbaa8b88-52f2a767-2b521a59-4284a667.mp3]
高,,gāo,gào,"high, tall; lofty, elevated", [sound:sapi5-ee2a3204-0ee53c46-b84eb8f9-138b68d7-1a6e655e.mp3]
间,間,jiān,jiàn,"midpoint, space; place, locality", [sound:sapi5-83d4743b-a694b512-b7bb57be-0d7ffd9d-7373df90.mp3]
由,,yóu,yāo,"cause, reason; from", [sound:sapi5-5c6a31f7-077e8781-6f1e7613-b795f516-ea057b68.mp3]
问,問,wèn,,"ask about, inquire after", [sound:sapi5-fdbcf40d-bf3092c1-50d2240e-c7f406cb-0412d69e.mp3]
很,,hěn,,"very, quite, much", [sound:sapi5-0bb5d1d5-e59558ec-c8130978-cdb4a04c-7ee62796.mp3]
最,,zuì,,"most, extremely, exceedingly", [sound:sapi5-bd28121c-4d982795-8fef2923-1e787426-930f3e33.mp3]
重,,zhòng,"chóng, tóng","heavy, weighty; double", [sound:sapi5-c13b56f7-170ad13a-0055ed55-25841cfd-218d3617.mp3]
并,并 併 並,bìng,bīng,"combine, annex; also, what's more", [sound:sapi5-7c354a63-684f4071-3eb5aabb-786b1a00-2fd2fd54.mp3]
物,,wù,,"thing, substance, creature", [sound:sapi5-e4453948-a6a473be-dc5f64a1-532f9be2-8cd38cc2.mp3]
手,,shǒu,,hand, [sound:sapi5-7dfbdd59-7780ad57-edce47d1-bcb68299-fd4a40f8.mp3]
应,應,yìng,yīng,"should, ought to, must", [sound:sapi5-97cd492d-7139135f-e9d437c7-693095fd-950dcfe1.mp3]
战,戰,zhàn,,"war, fighting, battle", [sound:sapi5-c6c77cbe-3d58f5cb-08390bb3-2b9e5678-d814ded2.mp3]
向,嚮 向,xiàng,,"toward, direction, trend", [sound:sapi5-cfbb3e26-764dcb0b-22c26abc-6e93e672-0fe24ca5.mp3]
头,頭,tóu,tou,"head; top; chief, first; boss", [sound:sapi5-cd133d11-2ea08342-d684d00b-720416fb-f8396e06.mp3]
文,,wén,wèn,"literature, culture, writing", [sound:sapi5-987cf5a0-2ae86176-a89d5f38-0ea8c372-fd4d7812.mp3]
体,体 體,tǐ,"bèn, tī","body; group, class, body, unit; inferior", [sound:sapi5-d42729e4-b0a4e0ba-90d4ffcd-70ce4020-c12a5e5a.mp3]
政,,zhèng,zhēng,"government, political affairs", [sound:sapi5-7cbcf1e1-6a5f23bf-eff6c907-654aaaf7-d9d40676.mp3]
美,,měi,,"beautiful, pretty; pleasing", [sound:sapi5-4b2ad17b-dab5bcb4-1e80b23e-7055e8ae-01cbe031.mp3]
相,,xiāng,xiàng,"mutual, reciprocal, each other", [sound:sapi5-ddafb1c3-77e48760-077f5d28-c9ea67df-0a7dde4b.mp3]
见,見,jiàn,xiàn,"see, observe, behold; perceive", [sound:sapi5-0fa33589-6a708af2-8e5d259a-ffdf3b7f-39651f80.mp3]
被,,bèi,"pī, bì, pì",passive indicator 'by'; bedding, [sound:sapi5-322a13d8-d9355c0f-b712529b-bc8850da-5716ea9a.mp3]
利,,lì,,"gains, advantage, profit, merit", [sound:sapi5-c2ce464b-9bd24c63-27c5b663-91630a06-f7587b49.mp3]
什,甚,shí,shén,"file of ten soldiers; mixed, miscellaneous", [sound:sapi5-0c0a3726-8a39c863-5e726234-facf9c7d-d7f314ec.mp3]
二,,èr,,two; twice, [sound:sapi5-040167de-ef42e15d-0d3269b7-6db844dc-480067ac.mp3]
等,,děng,,"rank, grade; wait; equal; 'etc.'", [sound:sapi5-43159af0-5e0cb198-0fb5770e-f82a8741-15f262b8.mp3]
产,產,chǎn,,"give birth, bring forth, produce", [sound:sapi5-2cdc0acd-1fabe8e0-de936223-01d3109c-3a8850fb.mp3]
或,,huò,yù,"or, either, else; perhaps, maybe", [sound:sapi5-5debb9e0-e0fc6bfe-97e26ed1-ad7199f3-3a0ad035.mp3]
新,,xīn,,"new, recent, fresh, modern", [sound:sapi5-65693986-a8b5153c-3f07815d-9d57fe4b-a5b57906.mp3]
己,,jǐ,,"self, oneself; personal, private; 6th heavenly stem", [sound:sapi5-71481a17-2ab66fb6-824c4783-a080c8aa-f52d1ba0.mp3]
制,製 制,zhì,,system; establish; overpower, [sound:sapi5-044150bc-58b152e6-abd097e3-b3961724-121280d3.mp3]
身,,shēn,"yuán, juān","body; trunk, hull; rad. no. 158", [sound:sapi5-b7ccc7de-afc230b2-023d75c9-44a18c31-f6028020.mp3]
果,,guǒ,"kè, luǒ, wǒ",fruit; result, [sound:sapi5-4343ecaf-a2656bb9-2b9a7c55-a612ce4c-5222f943.mp3]
加,,jiā,,"add to, increase, augment", [sound:sapi5-9e23e2bb-ab5b4086-d28975e1-4b3ec5a5-96d27297.mp3]
西,,xī,,"west(ern); westward, occident", [sound:sapi5-2ded7dbe-cd6610ba-9db21cd5-b4df6fe4-8d7729f6.mp3]
斯,,sī,,"this, thus, such; to lop off; emphatic particle", [sound:sapi5-604b2f07-57696eb1-13bf88df-90ee9c78-740d84e4.mp3]
月,,yuè,,moon; month; KangXi radical 74, [sound:sapi5-6097bafc-cd8ecc28-71249839-7b2e7d4d-de897240.mp3]
话,話,huà,,"speech, talk, language; dialect", [sound:sapi5-628e0c52-068308ee-19d2c01d-7b43c609-5df5220b.mp3]
合,閤,hé,gě,"combine, unite, join; gather", [sound:sapi5-69cb8d55-07ef7b80-5db44156-389bc242-754c06eb.mp3]
回,迴 回,huí,,"return, turn around; a time", [sound:sapi5-f09d228e-b17b5f62-47487951-467a447d-4648c608.mp3]
特,,tè,,"special, unique, distinguished", [sound:sapi5-a73388e6-af4d1a8d-61bdf47f-d0038624-2aa478b9.mp3]
代,,dài,,"replace, replacement (of person or generation); era, generation", [sound:sapi5-3fdd15ce-2e16c399-dec622a1-8113b6d3-79098f91.mp3]
内,內,nèi,,inside, [sound:sapi5-986ac1e3-f9c9b5b8-69df6460-05bb6e25-0ee4a62b.mp3]
信,,xìn,shēn,"trust, believe; letter", [sound:sapi5-10c42901-54a0eb5e-23430769-152a4d6c-0149e3a2.mp3]
表,錶 表,biǎo,,"show, express, manifest, display", [sound:sapi5-d665233f-968f9cbb-eeda0268-fc8e9beb-a8c95e1c.mp3]
化,,huà,huā,"change, convert, reform; -ize", [sound:sapi5-cd06fa68-cb4bbb8e-51ae7b8b-9da4da7a-936e4526.mp3]
老,,lǎo,,"old, aged; experienced", [sound:sapi5-8e1aae12-3cc133b4-9f5787d9-a9b0a52b-cf4c0f8a.mp3]
给,給,gěi,jǐ,"give; by, for", [sound:sapi5-75636c7c-552ea47a-badd2bc1-0a8b332a-ae4cacb0.mp3]
世,,shì,,generation; world; era, [sound:sapi5-1beec0ce-c74d7039-859ee113-661db3b2-a6cde078.mp3]
位,,wèi,,"throne; position, post; rank, status; seat", [sound:sapi5-31061e3d-a6c20ce7-6de3cec3-bf573953-fabd0784.mp3]
次,,cì,,"order, sequence; next", [sound:sapi5-687fecfe-83db0999-9994a16f-5f5215fb-b3cf608d.mp3]
度,,dù,duó,"degree, system; manner; to consider", [sound:sapi5-47b924de-9e35c129-ec9e9885-9c8574ee-35631cb0.mp3]
门,門,mén,,"gate, door, entrance, opening", [sound:sapi5-e4d5fbe1-7ff58307-3b899c01-8aff289a-f4d5c65b.mp3]
任,,rèn,rén,"trust to, rely on, appoint; to bear, duty, office; allow", [sound:sapi5-a5f8dd9f-da21fc8d-d1b954c4-708d37a6-3bc0e51f.mp3]
常,,cháng,,"common, normal, frequent, regular", [sound:sapi5-f64afbb8-962756ca-481ddf12-7766cb8f-e2ecd748.mp3]
先,,xiān,,"first, former, previous", [sound:sapi5-117e908c-93fcb9bc-779f9704-d0b17a39-053aaa3c.mp3]
海,,hǎi,,"sea, ocean; maritime", [sound:sapi5-47cae802-58b49c57-5fab9d02-5004e651-10d81a15.mp3]
通,,tōng,tòng,"pass through, common, communicate", [sound:sapi5-a5693c7d-12e558ad-e2dd9c9d-7ad49d0b-aec9c248.mp3]
教,,jiào,jiāo,"teach, class", [sound:sapi5-61a7502e-64367f67-d4853b49-da810e25-f5f8509f.mp3]
儿,兒,ér,er,"son, child; KangXi radical 10", [sound:sapi5-ebcf7941-b1a29e70-495e8574-c3881bcd-d6772b7b.mp3]
原,,yuán,yuàn,"source, origin, beginning", [sound:sapi5-7d65b9af-308b9fb2-5b9cc8e2-80e07e33-a03eb77e.mp3]
东,東,dōng,,"east, eastern, eastward", [sound:sapi5-599a3989-47a33e1f-9caf48d1-c9042e29-d06362ae.mp3]
声,聲,shēng,,"sound, voice, noise; tone; music", [sound:sapi5-dad7699b-ab2d1cf2-9836b603-87fae49e-8d9830f4.mp3]
提,,tí,"dī, dǐ, shí",hold in hand; lift in hand, [sound:sapi5-da2c3de8-867adc0b-11024a7c-ebca2ae1-363f9e22.mp3]
立,,lì,wèi,"stand; let stand; establish, set", [sound:sapi5-99551d51-3bb4c588-b524b6cf-18ac2c99-b11a1d75.mp3]
及,,jí,,extend; reach; come up to; and, [sound:sapi5-0ba85a83-a70c3277-162c10aa-666db083-0989f7d9.mp3]
比,,bǐ,"bì, pí, pǐ","to compare, liken; comparison; than", [sound:sapi5-d0c43e54-bb0d057f-03612b88-b3ae2e45-cba118b3.mp3]
员,員,yuán,yùn,"member; personnel, staff member", [sound:sapi5-47941531-a39bfeff-5a2fca5a-8cc11621-26307885.mp3]
解,,jiě,"jiè, xiè","loosen, unfasten, untie; explain", [sound:sapi5-988e6b4e-8065d209-bab6cf1a-e784085d-80d775db.mp3]
水,,shuǐ,,"water, liquid, lotion, juice", [sound:sapi5-83bcf035-ade80d2e-3e31bc8f-d9e0370f-0162b96a.mp3]
名,,míng,,"name, rank, title, position", [sound:sapi5-9cc9d4a6-03d9d73b-9334eb2f-027ccf67-fc807592.mp3]
真,,zhēn,,"real, actual, true, genuine", [sound:sapi5-555e3f94-451ed378-0a9fd104-609a39a8-e41ce88b.mp3]
论,論,lùn,lún,debate; discuss; discourse, [sound:sapi5-6ed1e644-f1fcfbc4-e4af74e8-edeaf460-391521d8.mp3]
处,處,chù,chǔ,"place, locale; department", [sound:sapi5-92b06e69-c026c26e-5dae9879-de663ef2-c720c964.mp3]
走,,zǒu,,"walk, go on foot; run; leave", [sound:sapi5-2be2b6c3-aa9132de-8445a00b-882b5273-3c54abba.mp3]
义,義,yì,,"right conduct, righteousness", [sound:sapi5-8f562acf-fea25a90-545d7e25-bb3d4ba0-1d5ec811.mp3]
各,,gè,,"each, individually, every, all", [sound:sapi5-08cb84ba-b4e60584-8b586d0c-297ec1d7-9cfe31cd.mp3]
入,,rù,,"enter, come in(to), join", [sound:sapi5-ef5a7888-21ab7282-603fcc82-40f2a1b5-44e2178f.mp3]
几,幾 几,jī,jǐ,small table, [sound:sapi5-e8b379e2-178b5d12-395c5ab8-f25a6117-71dbca86.mp3]
口,,kǒu,,"mouth; open end; entrance, gate", [sound:sapi5-ffb1cc0c-96eb9552-3348a2c0-f32f0418-c3c49856.mp3]
认,認,rèn,,"recognize, know, understand", [sound:sapi5-defefcef-d8e3bf69-5a771ffc-df67eb83-deae93ec.mp3]
条,條,tiáo,,"clause, condition; string, stripe", [sound:sapi5-8b505880-7d448b12-df06a64e-e7b940c6-d3d21508.mp3]
平,,píng,,"flat, level, even; peaceful", [sound:sapi5-b32c0b73-c8530aea-b601181a-d98a003e-552b3f04.mp3]
系,系 繫 係,xì,jì,"system; line, link, connection", [sound:sapi5-726ce975-2801cfd6-b4a6453a-be043d27-86818fda.mp3]
气,氣,qì,,"steam, vapor; KangXi radical 84", [sound:sapi5-f4b9bdcb-aa0cab54-9dfc6cff-40291dd4-e940b894.mp3]
题,題,tí,dì,"forehead; title, headline; theme", [sound:sapi5-664eeeef-496264ad-032feacc-45ecaf91-649998c0.mp3]
活,,huó,guō,"live, exist, survive; lively", [sound:sapi5-9e6d9559-89572a5a-be190ace-4630efc5-ae5d0a34.mp3]
尔,爾,ěr,,"you; that, those; final particle", [sound:sapi5-ad7abfc4-7f47ba4e-df613120-9679b6f2-d4441dca.mp3]
更,,gèng,gēng,"more, still further, much more", [sound:sapi5-95aa5e24-dacb9914-87a62de9-6d36ea95-78160ec5.mp3]
别,別 彆,bié,biè,"separate, other; do not", [sound:sapi5-d5e40e47-2988c7f6-3324c086-d969fd8c-79479ce0.mp3]
打,,dǎ,dá,"strike, hit, beat; fight; attack", [sound:sapi5-196147ab-e30a6978-5d71f0d5-c48e2569-9a113178.mp3]
女,,nǚ,rǔ,"woman, girl; feminine; rad. 38", [sound:sapi5-22459818-94ae0249-43913bd8-f7a1926d-3d81bc53.mp3]
变,變,biàn,,"change, transform, alter; rebel", [sound:sapi5-e761108e-e5540ff2-0a75094a-8dd4082e-028cacde.mp3]
四,,sì,,four, [sound:sapi5-2ca31db5-faa49f4f-90d261e6-a2929df0-c5857163.mp3]
神,,shén,shēn,"spirit, god, supernatural being", [sound:sapi5-1a05168e-4201bc4d-fbbe6d55-98617f00-034f2b6e.mp3]
总,總,zǒng,zōng,"collect; overall, altogether", [sound:sapi5-20bb23b8-49174966-9dab1a43-f923306e-fa11cc63.mp3]
何,,hé,hè,"what, why, where, which, how", [sound:sapi5-cd42a51f-fdc8ca24-77255f04-6748c078-b1c57451.mp3]
